[
  {
    "source_id": "SRC-KR-MOHW-KDRI-2025-PR",
    "title": "영양소 적정 섭취기준 개정",
    "source_type": "government_press_release",
    "organization": "보건복지부",
    "jurisdiction": "KR",
    "publication_year": 2025,
    "publication_date": "2025-??-??",
    "url": "https://www.mohw.go.kr/board.es?act=view&bid=0027&list_no=1488441&mid=a10503010100&nPage=3&tag=",
    "doi": null,
    "pmid": null,
    "authors": null,
    "journal": null,
    "evidence_tier": "national_reference_context",
    "access_model": "public",
    "ingestion_status": "ingested_chunked",
    "notes_ko": "2025 한국인 영양소 섭취기준 개정 보도자료. 41개 영양소, 연령·성별·생애주기 기준 제공."
  },
  {
    "source_id": "SRC-KR-MOHW-KDRI-2025",
    "title": "2025 한국인 영양소 섭취기준",
    "source_type": "national_dri",
    "organization": "보건복지부",
    "jurisdiction": "KR",
    "publication_year": 2025,
    "publication_date": "2025-12-31",
    "url": "https://www.mohw.go.kr/board.es?act=view&bid=0019&list_no=1488446&mid=a10411010300&nPage=1&tag=",
    "doi": null,
    "pmid": null,
    "authors": null,
    "journal": null,
    "evidence_tier": "national_reference",
    "access_model": "public",
    "ingestion_status": "catalog_only",
    "notes_ko": "추후 영양소별 수치 테이블 직접 추출 필요."
  },
  {
    "source_id": "SRC-KR-MFDS-HFF-NOTICE-2025-11",
    "title": "건강기능식품의 기준 및 규격 일부개정고시(고시 제2025-11호 2025.3.5)",
    "source_type": "regulation_notice",
    "organization": "식품의약품안전처",
    "jurisdiction": "KR",
    "publication_year": 2025,
    "publication_date": "2025-03-05",
    "url": "https://www.mfds.go.kr/brd/m_207/list.do?board_id=data0008&multi_itm_seq=0&seq=&srchTp=0&srchWord=%EA%B1%B4%EA%B0%95%EA%B8%B0%EB%8A%A5%EC%8B%9D%ED%92%88",
    "doi": null,
    "pmid": null,
    "authors": null,
    "journal": null,
    "evidence_tier": "regulation",
    "access_model": "public",
    "ingestion_status": "catalog_only",
    "notes_ko": "건강기능식품 기준·규격 최신 고시. 성분별 1일 섭취량과 표시 주의사항의 1차 근거."
  },
  {
    "source_id": "SRC-KR-FOODSAFETY-INGREDIENT-BOARD",
    "title": "건강기능식품 원료별 정보",
    "source_type": "government_database",
    "organization": "식품안전나라",
    "jurisdiction": "KR",
    "publication_year": null,
    "publication_date": null,
    "url": "https://www.foodsafetykorea.go.kr/portal/board/board.do?menu_grp=MENU_NEW01&menu_no=2660",
    "doi": null,
    "pmid": null,
    "authors": null,
    "journal": null,
    "evidence_tier": "government_database",
    "access_model": "public",
    "ingestion_status": "catalog_only",
    "notes_ko": "원료별 심사결과보고서/기능성 정보의 진입점."
  },
  {
    "source_id": "SRC-KR-FOODSAFETY-CAUTION-BOARD",
    "title": "건강기능식품 섭취 주의사항",
    "source_type": "government_database",
    "organization": "식품안전나라",
    "jurisdiction": "KR",
    "publication_year": null,
    "publication_date": null,
    "url": "https://www.foodsafetykorea.go.kr/portal/board/board.do?menu_grp=MENU_NEW01&menu_no=3702",
    "doi": null,
    "pmid": null,
    "authors": null,
    "journal": null,
    "evidence_tier": "government_database",
    "access_model": "public",
    "ingestion_status": "catalog_only",
    "notes_ko": "건강기능식품과 의약품 병용 섭취 주의사항 게시판 진입점."
  },
  {
    "source_id": "SRC-KR-MFDS-AE-DATA",
    "title": "건강기능식품 이상사례 신고 현황",
    "source_type": "adverse_event_dataset",
    "organization": "식품의약품안전처",
    "jurisdiction": "KR",
    "publication_year": null,
    "publication_date": null,
    "url": null,
    "doi": null,
    "pmid": null,
    "authors": null,
    "journal": null,
    "evidence_tier": "post_marketing_signal",
    "access_model": "public",
    "ingestion_status": "catalog_only",
    "notes_ko": "MFDS 이상사례 공개 데이터. 후속 시그널 탐지용."
  },
  {
    "source_id": "SRC-KR-FOODSAFETY-REEVAL-2024",
    "title": "2024 건강기능식품 기능성 원료 재평가 결과 공시",
    "source_type": "government_notice",
    "organization": "식품안전나라",
    "jurisdiction": "KR",
    "publication_year": 2024,
    "publication_date": null,
    "url": null,
    "doi": null,
    "pmid": null,
    "authors": null,
    "journal": null,
    "evidence_tier": "government_notice",
    "access_model": "public",
    "ingestion_status": "catalog_only",
    "notes_ko": "원료 재평가 결과. 개별 원료 안전성/기능성 검토의 한국 근거."
  },
  {
    "source_id": "SRC-US-ODS-NUTRIENT-REC",
    "title": "Nutrient Recommendations and Databases",
    "source_type": "government_guideline",
    "organization": "NIH Office of Dietary Supplements",
    "jurisdiction": "US",
    "publication_year": 2025,
    "publication_date": null,
    "url": "https://ods.od.nih.gov/HealthInformation/nutrientrecommendations.aspx",
    "doi": null,
    "pmid": null,
    "authors": null,
    "journal": null,
    "evidence_tier": "government_guideline",
    "access_model": "public",
    "ingestion_status": "ingested_chunked",
    "notes_ko": "UL 정의 등 영양소 기준 해석용 공통 기준."
  },
  {
    "source_id": "SRC-EU-EFSA-UL-SUMMARY-2025",
    "title": "Overview on Tolerable Upper Intake Levels as derived by the Scientific Committee on Food (SCF) and the EFSA Panel on Dietetic Products, Nutrition and Allergies (NDA)",
    "source_type": "technical_report",
    "organization": "European Food Safety Authority",
    "jurisdiction": "EU",
    "publication_year": 2025,
    "publication_date": "2025-08-01",
    "url": "https://www.efsa.europa.eu/sites/default/files/2024-05/ul-summary-report.pdf",
    "doi": null,
    "pmid": null,
    "authors": null,
    "journal": null,
    "evidence_tier": "regional_guideline",
    "access_model": "public",
    "ingestion_status": "ingested_chunked",
    "notes_ko": "EFSA UL summary report v11 (Aug 2025). EU 비교 기준."
  },
  {
    "source_id": "SRC-US-FDA-CAERS",
    "title": "Center for Food Safety and Applied Nutrition Adverse Event Reporting System",
    "source_type": "adverse_event_dataset",
    "organization": "U.S. Food and Drug Administration",
    "jurisdiction": "US",
    "publication_year": null,
    "publication_date": null,
    "url": "https://open.fda.gov/data/caers/",
    "doi": null,
    "pmid": null,
    "authors": null,
    "journal": null,
    "evidence_tier": "post_marketing_signal",
    "access_model": "public",
    "ingestion_status": "ingested_chunked",
    "notes_ko": "식품/건기식/화장품 이상사례 데이터."
  },
  {
    "source_id": "SRC-US-ODS-VITAMIN-A",
    "title": "Vitamin A and Carotenoids - Health Professional Fact Sheet",
    "source_type": "government_fact_sheet",
    "organization": "NIH Office of Dietary Supplements",
    "jurisdiction": "US",
    "publication_year": 2025,
    "publication_date": null,
    "url": "https://ods.od.nih.gov/factsheets/VitaminA-HealthProfessional/",
    "doi": null,
    "pmid": null,
    "authors": null,
    "journal": null,
    "evidence_tier": "government_fact_sheet",
    "access_model": "public",
    "ingestion_status": "ingested_chunked",
    "notes_ko": null
  },
  {
    "source_id": "SRC-US-ODS-VITAMIN-D",
    "title": "Vitamin D - Health Professional Fact Sheet",
    "source_type": "government_fact_sheet",
    "organization": "NIH Office of Dietary Supplements",
    "jurisdiction": "US",
    "publication_year": 2025,
    "publication_date": null,
    "url": "https://ods.od.nih.gov/factsheets/VitaminD-HealthProfessional/",
    "doi": null,
    "pmid": null,
    "authors": null,
    "journal": null,
    "evidence_tier": "government_fact_sheet",
    "access_model": "public",
    "ingestion_status": "ingested_chunked",
    "notes_ko": null
  },
  {
    "source_id": "SRC-US-ODS-CALCIUM",
    "title": "Calcium - Health Professional Fact Sheet",
    "source_type": "government_fact_sheet",
    "organization": "NIH Office of Dietary Supplements",
    "jurisdiction": "US",
    "publication_year": 2025,
    "publication_date": null,
    "url": "https://ods.od.nih.gov/factsheets/Calcium-HealthProfessional/",
    "doi": null,
    "pmid": null,
    "authors": null,
    "journal": null,
    "evidence_tier": "government_fact_sheet",
    "access_model": "public",
    "ingestion_status": "ingested_chunked",
    "notes_ko": null
  },
  {
    "source_id": "SRC-US-ODS-MAGNESIUM",
    "title": "Magnesium - Health Professional Fact Sheet",
    "source_type": "government_fact_sheet",
    "organization": "NIH Office of Dietary Supplements",
    "jurisdiction": "US",
    "publication_year": 2025,
    "publication_date": null,
    "url": "https://ods.od.nih.gov/factsheets/Magnesium-HealthProfessional/",
    "doi": null,
    "pmid": null,
    "authors": null,
    "journal": null,
    "evidence_tier": "government_fact_sheet",
    "access_model": "public",
    "ingestion_status": "ingested_chunked",
    "notes_ko": null
  },
  {
    "source_id": "SRC-US-ODS-IRON",
    "title": "Iron - Health Professional Fact Sheet",
    "source_type": "government_fact_sheet",
    "organization": "NIH Office of Dietary Supplements",
    "jurisdiction": "US",
    "publication_year": 2025,
    "publication_date": null,
    "url": "https://ods.od.nih.gov/factsheets/Iron-HealthProfessional/",
    "doi": null,
    "pmid": null,
    "authors": null,
    "journal": null,
    "evidence_tier": "government_fact_sheet",
    "access_model": "public",
    "ingestion_status": "ingested_chunked",
    "notes_ko": null
  },
  {
    "source_id": "SRC-US-ODS-FOLATE",
    "title": "Folate - Health Professional Fact Sheet",
    "source_type": "government_fact_sheet",
    "organization": "NIH Office of Dietary Supplements",
    "jurisdiction": "US",
    "publication_year": 2025,
    "publication_date": null,
    "url": "https://ods.od.nih.gov/factsheets/Folate-HealthProfessional/",
    "doi": null,
    "pmid": null,
    "authors": null,
    "journal": null,
    "evidence_tier": "government_fact_sheet",
    "access_model": "public",
    "ingestion_status": "ingested_chunked",
    "notes_ko": null
  },
  {
    "source_id": "SRC-US-ODS-VITAMIN-K",
    "title": "Vitamin K - Health Professional Fact Sheet",
    "source_type": "government_fact_sheet",
    "organization": "NIH Office of Dietary Supplements",
    "jurisdiction": "US",
    "publication_year": 2025,
    "publication_date": null,